{
  "schema": "switchback/launch-profiles@1",
  "provider_lanes": {
    "zai": {
      "route": "zai/glm-5.2",
      "requested_model": "glm-5.2",
      "transport": "headroom",
      "credential_ref": {
        "kind": "env",
        "name": "ZAI_API_KEY"
      },
      "anthropic_tap_port": 18772,
      "headroom_port": 8790,
      "headroom_tool_search": false,
      "claude_via_tap": true,
      "min_fallbacks": 1
    },
    "qwen": {
      "route": "qwen/qwen3.8-max-preview",
      "requested_model": "qwen3.8-max-preview",
      "transport": "headroom",
      "credential_ref": {
        "kind": "env",
        "name": "QWEN_API_KEY"
      },
      "anthropic_tap_port": 18777,
      "openai_tap_port": 18778,
      "headroom_port": 8791,
      "headroom_tool_search": false,
      "claude_via_tap": true,
      "min_fallbacks": 1
    },
    "deepseek": {
      "route": "deepseek/deepseek-v4-flash",
      "requested_model": "deepseek-v4-flash",
      "transport": "gateway",
      "credential_ref": {
        "kind": "env",
        "name": "DEEPSEEK_API_KEY"
      },
      "openai_tap_port": 18779,
      "min_fallbacks": 0
    },
    "minimax": {
      "route": "minimax/MiniMax-M3",
      "requested_model": "MiniMax-M3",
      "transport": "tap",
      "credential_ref": {
        "kind": "env",
        "name": "MINIMAX_API_KEY"
      },
      "anthropic_tap_port": 18790,
      "min_fallbacks": 0
    }
  },
  "harness_presets": {
    "claude-rich-zai": {
      "harness": "claude-code",
      "native_effort": "xhigh",
      "model_aliases": {
        "default": "glm-5.2[1m]",
        "opus": "glm-5.2[1m]",
        "sonnet": "glm-5.2[1m]",
        "haiku": "glm-4.5-air",
        "subagent": "glm-5.2[1m]"
      },
      "compaction_window": 1000000,
      "permissions_mode": "inherit_allowlisted",
      "mcp_mode": "all",
      "skills_mode": "enabled",
      "settings_mode": "inherit_allowlisted",
      "launch_args": [
        "--rich"
      ]
    },
    "claude-rich-qwen": {
      "harness": "claude-code",
      "native_effort": "xhigh",
      "model_aliases": {
        "default": "qwen3.8-max-preview",
        "opus": "qwen3.8-max-preview",
        "sonnet": "qwen3.7-plus",
        "haiku": "qwen3.6-flash",
        "subagent": "qwen3.7-max"
      },
      "compaction_window": 983616,
      "permissions_mode": "inherit_allowlisted",
      "mcp_mode": "all",
      "skills_mode": "enabled",
      "settings_mode": "inherit_allowlisted",
      "launch_args": [
        "--rich"
      ]
    },
    "omp-headless": {
      "harness": "omp",
      "native_effort": "high",
      "permissions_mode": "minimal",
      "mcp_mode": "none",
      "skills_mode": "disabled",
      "settings_mode": "minimal",
      "expected_version": "18.0.0"
    },
    "qwen-headless": {
      "harness": "qwen-code",
      "native_effort": "default",
      "permissions_mode": "minimal",
      "mcp_mode": "none",
      "skills_mode": "disabled",
      "settings_mode": "minimal",
      "expected_version": "0.21.15"
    },
    "dsh-headless": {
      "harness": "deepseek-harness",
      "native_effort": "default",
      "permissions_mode": "minimal",
      "mcp_mode": "none",
      "skills_mode": "disabled",
      "settings_mode": "minimal",
      "expected_version": "0.1.0-rc.7"
    },
    "prime-minimax": {
      "harness": "prime-agent",
      "native_effort": "xhigh",
      "permissions_mode": "minimal",
      "mcp_mode": "none",
      "skills_mode": "disabled",
      "settings_mode": "minimal"
    }
  },
  "capture_policies": {
    "observed": {
      "mode": "segmented_full_wire"
    }
  },
  "launch_profiles": {
    "claude-zai-full": {
      "provider_lane": "zai",
      "harness_preset": "claude-rich-zai",
      "capture_policy": "observed",
      "profile_label": "zai-lane",
      "wrappers": [
        "claude-zai-full"
      ]
    },
    "claude-qwen": {
      "provider_lane": "qwen",
      "harness_preset": "claude-rich-qwen",
      "capture_policy": "observed",
      "profile_label": "qwen",
      "wrappers": [
        "claude-qwen"
      ]
    },
    "omp-qwen": {
      "provider_lane": "qwen",
      "harness_preset": "omp-headless",
      "capture_policy": "observed",
      "profile_label": "omp-qwen",
      "wrappers": [
        "omp-qwen"
      ]
    },
    "qwen-code-qwen": {
      "provider_lane": "qwen",
      "harness_preset": "qwen-headless",
      "capture_policy": "observed",
      "profile_label": "qwen-code-qwen",
      "wrappers": [
        "qwen-code-qwen"
      ]
    },
    "dsh-deepseek": {
      "provider_lane": "deepseek",
      "harness_preset": "dsh-headless",
      "capture_policy": "observed",
      "profile_label": "dsh-deepseek",
      "wrappers": [
        "dsh-deepseek"
      ]
    },
    "prime-minimax": {
      "provider_lane": "minimax",
      "harness_preset": "prime-minimax",
      "capture_policy": "observed",
      "profile_label": "minimax-prime",
      "wrappers": [
        "prime-minimax"
      ]
    }
  }
}
